[
  {
    "id": "aku",
    "teks": "aku",
    "suku_kata": ["a", "ku"],
    "jumlah_suku_kata": 2,
    "pola": ["V", "KV"],
    "level": 2,
    "kategori": "kata-ganti",
    "emoji": null,
    "gambar": null,
    "audio": null
  },
  {
    "id": "apa",
    "teks": "apa",
    "suku_kata": ["a", "pa"],
    "jumlah_suku_kata": 2,
    "pola": ["V", "KV"],
    "level": 2,
    "kategori": "kata-tugas",
    "emoji": null,
    "gambar": null,
    "audio": null
  },
  {
    "id": "api",
    "teks": "api",
    "suku_kata": ["a", "pi"],
    "jumlah_suku_kata": 2,
    "pola": ["V", "KV"],
    "level": 2,
    "kategori": "alam",
    "emoji": "🔥",
    "gambar": null,
    "audio": null
  },
  {
    "id": "baca",
    "teks": "baca",
    "suku_kata": ["ba", "ca"],
    "jumlah_suku_kata": 2,
    "pola": ["KV", "KV"],
    "level": 2,
    "kategori": "kata-kerja",
    "emoji": "📖",
    "gambar": null,
    "audio": null
  },
  {
    "id": "bahu",
    "teks": "bahu",
    "suku_kata": ["ba", "hu"],
    "jumlah_suku_kata": 2,
    "pola": ["KV", "KV"],
    "level": 2,
    "kategori": "tubuh",
    "emoji": "💪",
    "gambar": null,
    "audio": null
  },
  {
    "id": "baju",
    "teks": "baju",
    "suku_kata": ["ba", "ju"],
    "jumlah_suku_kata": 2,
    "pola": ["KV", "KV"],
    "level": 2,
    "kategori": "pakaian",
    "emoji": "👕",
    "gambar": null,
    "audio": null
  },
  {
    "id": "baru",
    "teks": "baru",
    "suku_kata": ["ba", "ru"],
    "jumlah_suku_kata": 2,
    "pola": ["KV", "KV"],
    "level": 2,
    "kategori": "kata-sifat",
    "emoji": null,
    "gambar": null,
    "audio": null
  },
  {
    "id": "batu",
    "teks": "batu",
    "suku_kata": ["ba", "tu"],
    "jumlah_suku_kata": 2,
    "pola": ["KV", "KV"],
    "level": 2,
    "kategori": "benda",
    "emoji": "🪨",
    "gambar": null,
    "audio": null
  },
  {
    "id": "bawa",
    "teks": "bawa",
    "suku_kata": ["ba", "wa"],
    "jumlah_suku_kata": 2,
    "pola": ["KV", "KV"],
    "level": 2,
    "kategori": "kata-kerja",
    "emoji": null,
    "gambar": null,
    "audio": null
  },
  {
    "id": "beli",
    "teks": "beli",
    "suku_kata": ["be", "li"],
    "jumlah_suku_kata": 2,
    "pola": ["KV", "KV"],
    "level": 2,
    "kategori": "kata-kerja",
    "emoji": "🛒",
    "gambar": null,
    "audio": null
  },
  {
    "id": "bibi",
    "teks": "bibi",
    "suku_kata": ["bi", "bi"],
    "jumlah_suku_kata": 2,
    "pola": ["KV", "KV"],
    "level": 2,
    "kategori": "keluarga",
    "emoji": "👩",
    "gambar": null,
    "audio": null
  },
  {
    "id": "biru",
    "teks": "biru",
    "suku_kata": ["bi", "ru"],
    "jumlah_suku_kata": 2,
    "pola": ["KV", "KV"],
    "level": 2,
    "kategori": "warna",
    "emoji": "🔵",
    "gambar": null,
    "audio": null
  },
  {
    "id": "bisa",
    "teks": "bisa",
    "suku_kata": ["bi", "sa"],
    "jumlah_suku_kata": 2,
    "pola": ["KV", "KV"],
    "level": 2,
    "kategori": "kata-tugas",
    "emoji": null,
    "gambar": null,
    "audio": null
  },
  {
    "id": "bola",
    "teks": "bola",
    "suku_kata": ["bo", "la"],
    "jumlah_suku_kata": 2,
    "pola": ["KV", "KV"],
    "level": 2,
    "kategori": "benda",
    "emoji": "⚽",
    "gambar": null,
    "audio": null
  },
  {
    "id": "buka",
    "teks": "buka",
    "suku_kata": ["bu", "ka"],
    "jumlah_suku_kata": 2,
    "pola": ["KV", "KV"],
    "level": 2,
    "kategori": "kata-kerja",
    "emoji": "📂",
    "gambar": null,
    "audio": null
  },
  {
    "id": "buku",
    "teks": "buku",
    "suku_kata": ["bu", "ku"],
    "jumlah_suku_kata": 2,
    "pola": ["KV", "KV"],
    "level": 2,
    "kategori": "benda",
    "emoji": "📖",
    "gambar": null,
    "audio": null
  },
  {
    "id": "bumi",
    "teks": "bumi",
    "suku_kata": ["bu", "mi"],
    "jumlah_suku_kata": 2,
    "pola": ["KV", "KV"],
    "level": 2,
    "kategori": "alam",
    "emoji": "🌍",
    "gambar": null,
    "audio": null
  },
  {
    "id": "celana",
    "teks": "celana",
    "suku_kata": ["ce", "la", "na"],
    "jumlah_suku_kata": 3,
    "pola": ["KV", "KV", "KV"],
    "level": 2,
    "kategori": "pakaian",
    "emoji": "👖",
    "gambar": null,
    "audio": null
  },
  {
    "id": "cuci",
    "teks": "cuci",
    "suku_kata": ["cu", "ci"],
    "jumlah_suku_kata": 2,
    "pola": ["KV", "KV"],
    "level": 2,
    "kategori": "kata-kerja",
    "emoji": "🧼",
    "gambar": null,
    "audio": null
  },
  {
    "id": "dada",
    "teks": "dada",
    "suku_kata": ["da", "da"],
    "jumlah_suku_kata": 2,
    "pola": ["KV", "KV"],
    "level": 2,
    "kategori": "tubuh",
    "emoji": "🫁",
    "gambar": null,
    "audio": null
  },
  {
    "id": "dadu",
    "teks": "dadu",
    "suku_kata": ["da", "du"],
    "jumlah_suku_kata": 2,
    "pola": ["KV", "KV"],
    "level": 2,
    "kategori": "benda",
    "emoji": "🎲",
    "gambar": null,
    "audio": null
  },
  {
    "id": "dahi",
    "teks": "dahi",
    "suku_kata": ["da", "hi"],
    "jumlah_suku_kata": 2,
    "pola": ["KV", "KV"],
    "level": 2,
    "kategori": "tubuh",
    "emoji": "🤔",
    "gambar": null,
    "audio": null
  },
  {
    "id": "dasi",
    "teks": "dasi",
    "suku_kata": ["da", "si"],
    "jumlah_suku_kata": 2,
    "pola": ["KV", "KV"],
    "level": 2,
    "kategori": "pakaian",
    "emoji": "👔",
    "gambar": null,
    "audio": null
  },
  {
    "id": "desa",
    "teks": "desa",
    "suku_kata": ["de", "sa"],
    "jumlah_suku_kata": 2,
    "pola": ["KV", "KV"],
    "level": 2,
    "kategori": "tempat",
    "emoji": "🏘️",
    "gambar": null,
    "audio": null
  },
  {
    "id": "di",
    "teks": "di",
    "suku_kata": ["di"],
    "jumlah_suku_kata": 1,
    "pola": ["KV"],
    "level": 2,
    "kategori": "kata-tugas",
    "emoji": null,
    "gambar": null,
    "audio": null
  },
  {
    "id": "dia",
    "teks": "dia",
    "suku_kata": ["di", "a"],
    "jumlah_suku_kata": 2,
    "pola": ["KV", "V"],
    "level": 2,
    "kategori": "kata-ganti",
    "emoji": null,
    "gambar": null,
    "audio": null
  },
  {
    "id": "dua",
    "teks": "dua",
    "suku_kata": ["du", "a"],
    "jumlah_suku_kata": 2,
    "pola": ["KV", "V"],
    "level": 2,
    "kategori": "angka",
    "emoji": "2️⃣",
    "gambar": null,
    "audio": null
  },
  {
    "id": "foto",
    "teks": "foto",
    "suku_kata": ["fo", "to"],
    "jumlah_suku_kata": 2,
    "pola": ["KV", "KV"],
    "level": 2,
    "kategori": "benda",
    "emoji": "📷",
    "gambar": null,
    "audio": null
  },
  {
    "id": "gereja",
    "teks": "gereja",
    "suku_kata": ["ge", "re", "ja"],
    "jumlah_suku_kata": 3,
    "pola": ["KV", "KV", "KV"],
    "level": 2,
    "kategori": "tempat",
    "emoji": "⛪",
    "gambar": null,
    "audio": null
  },
  {
    "id": "gigi",
    "teks": "gigi",
    "suku_kata": ["gi", "gi"],
    "jumlah_suku_kata": 2,
    "pola": ["KV", "KV"],
    "level": 2,
    "kategori": "tubuh",
    "emoji": "🦷",
    "gambar": null,
    "audio": null
  },
  {
    "id": "gula",
    "teks": "gula",
    "suku_kata": ["gu", "la"],
    "jumlah_suku_kata": 2,
    "pola": ["KV", "KV"],
    "level": 2,
    "kategori": "makanan",
    "emoji": "🍬",
    "gambar": null,
    "audio": null
  },
  {
    "id": "hari",
    "teks": "hari",
    "suku_kata": ["ha", "ri"],
    "jumlah_suku_kata": 2,
    "pola": ["KV", "KV"],
    "level": 2,
    "kategori": "waktu",
    "emoji": "📅",
    "gambar": null,
    "audio": null
  },
  {
    "id": "ibu",
    "teks": "ibu",
    "suku_kata": ["i", "bu"],
    "jumlah_suku_kata": 2,
    "pola": ["V", "KV"],
    "level": 2,
    "kategori": "keluarga",
    "emoji": "👩",
    "gambar": null,
    "audio": null
  },
  {
    "id": "ini",
    "teks": "ini",
    "suku_kata": ["i", "ni"],
    "jumlah_suku_kata": 2,
    "pola": ["V", "KV"],
    "level": 2,
    "kategori": "kata-ganti",
    "emoji": null,
    "gambar": null,
    "audio": null
  },
  {
    "id": "itu",
    "teks": "itu",
    "suku_kata": ["i", "tu"],
    "jumlah_suku_kata": 2,
    "pola": ["V", "KV"],
    "level": 2,
    "kategori": "kata-ganti",
    "emoji": null,
    "gambar": null,
    "audio": null
  },
  {
    "id": "jaga",
    "teks": "jaga",
    "suku_kata": ["ja", "ga"],
    "jumlah_suku_kata": 2,
    "pola": ["KV", "KV"],
    "level": 2,
    "kategori": "kata-kerja",
    "emoji": null,
    "gambar": null,
    "audio": null
  },
  {
    "id": "jari",
    "teks": "jari",
    "suku_kata": ["ja", "ri"],
    "jumlah_suku_kata": 2,
    "pola": ["KV", "KV"],
    "level": 2,
    "kategori": "tubuh",
    "emoji": "☝️",
    "gambar": null,
    "audio": null
  },
  {
    "id": "kaca",
    "teks": "kaca",
    "suku_kata": ["ka", "ca"],
    "jumlah_suku_kata": 2,
    "pola": ["KV", "KV"],
    "level": 2,
    "kategori": "benda",
    "emoji": "🪟",
    "gambar": null,
    "audio": null
  },
  {
    "id": "kaki",
    "teks": "kaki",
    "suku_kata": ["ka", "ki"],
    "jumlah_suku_kata": 2,
    "pola": ["KV", "KV"],
    "level": 2,
    "kategori": "tubuh",
    "emoji": "🦶",
    "gambar": null,
    "audio": null
  },
  {
    "id": "kami",
    "teks": "kami",
    "suku_kata": ["ka", "mi"],
    "jumlah_suku_kata": 2,
    "pola": ["KV", "KV"],
    "level": 2,
    "kategori": "kata-ganti",
    "emoji": null,
    "gambar": null,
    "audio": null
  },
  {
    "id": "kamu",
    "teks": "kamu",
    "suku_kata": ["ka", "mu"],
    "jumlah_suku_kata": 2,
    "pola": ["KV", "KV"],
    "level": 2,
    "kategori": "kata-ganti",
    "emoji": "🫵",
    "gambar": null,
    "audio": null
  },
  {
    "id": "kayu",
    "teks": "kayu",
    "suku_kata": ["ka", "yu"],
    "jumlah_suku_kata": 2,
    "pola": ["KV", "KV"],
    "level": 2,
    "kategori": "benda",
    "emoji": "🪵",
    "gambar": null,
    "audio": null
  },
  {
    "id": "ke",
    "teks": "ke",
    "suku_kata": ["ke"],
    "jumlah_suku_kata": 1,
    "pola": ["KV"],
    "level": 2,
    "kategori": "kata-tugas",
    "emoji": null,
    "gambar": null,
    "audio": null
  },
  {
    "id": "keju",
    "teks": "keju",
    "suku_kata": ["ke", "ju"],
    "jumlah_suku_kata": 2,